code,percentage,localname,englishname,contributors
nl,100,Nederlands,Dutch,Ernst Bunders Hennie Eerhart martijn vincent Tomasz Nguyen carel.ketelaars Paul van Rijn Mehh Yorrick Hardeman tomas.scheldeman Richard Martijn D. Aart van Oploo joost Anton Jos Geluk Frank sraslan reyjamin aartdijkstra rory Mitch Gooijer rob ingeschuffelen 2BeFresh trudyvendel peterfick.nl marloesknetemann alex bram.kort t.aski raymondlukassen rikroukens Reggie Dinsbach
vi,100,Tiếng Việt,Vietnamese,Vũ Văn Hoàn - Asanzo Hà Nội buitrunghau yewleung Nguyễn Đình Quân Duy Trung tbn.tran93 hungphamquoc Pablo Alvarado lequanghoa hoanglongrs xoojulian lxkhanh189
sr,100,srpski,Serbian,analiza.fin.izvjestaja vojkan.milovanovic dragan.vukosavljevic Nikola Maric Dr Nedic Nikola dragoslav.nikolic tanicbozidar bojanpavlovicoffice draganmatrox Goran Jordović
is,100,íslenska,Icelandic,Gunnar Geir snaei8 heimir kjartansverrisson mattiazer omar advocat vorverk ingimarjons
et,100,eesti,Estonian,Gunnar Michelson jjk arva.arp raha 6598335 rivozangov secret123
mk,100,македонски јазик,Macedonian,novica Predrag Tasevski marko.aleksov gligorovski.g dlalkov
zh-HK,100,中文(香港),Traditional Chinese (Hong Kong),erph.com.hk
id,99,Bahasa Indonesia,Indonesian,reyjamin stanisk3101 Yhoga Heru Pratama kapkuncara Ajisaka teddie tesargusmawan w.nugrahadi mandau Anies Pertiwi adipriyanto.bpn darmawan.sidiq 19.guardians rahmat khairfathul jeppy.chriz herrycandi1963 fikri514 didi.purwadi mastertranskrip tuliskode amantun rhama.donny ubaylicious morsen_hepi sariningbhuana bermansnbbn dnirawan79
el,99,Ελληνικά,Greek,ntrimmis Antonis Vlachos pandhm Kostas Subdee giorgos.arnakis manolis Stathis Mellios dpantoulas skazakis nitro912gr theodorakisg leongreece info panarapi forologinpc pcon konstantinos.tsatsarounos aristeidisgkoros vcharlos delliospetros
af,99,Afrikaans,Afrikaans,martinmeyer007 jannie durkpotgieter claudine.venter1 thinusg belinda.truscott gerhard.bez alex.caudron hitimanajphugues Andrew van der Spuy
sq,98,shqipe,Albanian,Egzon Prokupla jurild_hoxha Suad A. Tafili atdhe_19 taulant.haxholli
ar,98,العربية,Arabic,Haitham Doraidy mohammad naji yaser nanoua Abdulbari mokhles.atallah efaiald Yasser Elkhateeb €gypt southern.carpenter majed404 imosa3da a.gamal.eldin88 luai.naji k.alqaheri loubani.yahia samarrai m256a acc.mohamedhamza88 adnan facysd SBSCC aalkaf.94 z.kheliwi usama.ibraheem akhatib ms.ismail scony10 ashraf.i.salameh magasal20 atmaalouf asaawan rizkadel ali.nasser.93 yasir_smart8889 bookkuwait osman.a.mahmoud mohammadayoubq aabuzaid mohammedessam111 omair5354 omarelmasry2006 aymanaaat jihad
de,98,Deutsch,German,Daniel Ruf Marko Langer d_k1 nielsaufdeepspace9 khargoth24 taieyaman tosho1994 Manuel Klarmann abdulshafie99 Daniel Banck arno
lt,97,lietuvių,Lithuanian,MES GALIM irina edlu73 ramunas atolodas andrius Povilas Klusas
pt,96,Português,Portuguese,Manuela Silva bmrcarneiro Nuno Lopes celexi Alexsander Donay Samuel Mesquita Ana Fonseca ido sooskca chinguelessi euhudson godoyjon Lucas diego.viegas felipe Luis Panao osmar.mateus guilhermeschneiderbr luiz aapinto
tr,96,Türkçe,Turkish,ahmetnsr07 erincfirtina posta Ufuk enesemretas ŞENOL KOÇAN bunyaminkoz ademalp selimelitas7 ipek srknakarcay ilham123836 brnozcan alisanari doganhatip İsmail Demirbilek a.kadirgngr talatcorak okanciftci34 netusta alierhanersoy berke.turgan artunalyan ahmet Egzon Prokupla
ro,93,română,Romanian,consult.brasov paul.pitea Sorin vfrunza Catalin Dragomirescu vasile.chisu toda ioan
da,93,dansk,Danish,finnwandersen fh Torben Hasse Kirkegaard railer12 soren wegeberg kurtha bkooss
sv,92,svenska,Swedish,Jan-Eric Lindh larsonniwik Fredrik Duwell mattenrone
ht,92,kreyòl,Haitian,Johnson
fa,92,فارسى,Persian,pnshad Aiub MRNasseri o.ahmadi.mail monib19 hamzelo.ali mehdi_song torabian.7 metalixon mo_jair efa kamitoto1995 programingc42 waheed navidhaghi peyman.mohamadpour
es,86,español,Spanish,Marco Picón oscargonz Diego Represas jf150552 taxmatters.richmond cametiope romsaz info juanmagic01 josegjimenez greatexe Luis Galvez lublanchod fernando.lguevara Angel luis info Freddy Isaac egonzalez osorio022 Luigi caparra des antoniomagagna ferwind alaskamama flira1010 malrod waldinads1987 gustavo franciscobama leonsk29 info rodrigo.ortiz arlopeza leoxordonez
sk,86,slovenčina,Slovak,managerioslovak Lubos Hasko hiddenvs pavol.paluga Július Meri monikafoster
hr,85,hrvatski,Croatian,vedran.ivancevic daniel.phenomena frost.giant.miniatures zsvegar darko.borojevic bbbbxxx civija mario.strmen.dvorski christian misic.mirko
de-CH,83,Deutsch (Schweiz),German (Switzerland),Radio64 johnwhosmithwatson Phantom75 wkfrehner
fr,82,français,French,antoinebargel nujabe.com webtranslateit.com 500assets.com jpmorin nicolas julien Erwin Mayer scialet Daniel G olivier.asselin doris.gagnon eriam kdaffef pavel Wesly  robert ju alexandrehitchcox alexandre.gauvin natalia.pokrovskaya karensg.mk lamarane antoine.rouse Abdellah Elfilali mickaelramanitrera rabodanmaha chsmo33
az,82,Azərbaycan,Azeri,anarsmac elxan96 90ez090 moize
sl,81,slovenski,Slovenian,David blaziusgr Silvo Jakob Gregor Sušanj Jure Medved Ivo foseklin marko.munda andrej.volpi lionidas0001 bostjan.petru thegreatwise
te,77,తెలుగు,Telugu,sekhar.apps10 kesava reddy hana raj.nann vsurimanchi vveeru19
si,76,siṁhala,Sinhala,admin Pahan SBSCC virajkavn sheronwollas chanakaicdl thisara.gunathilaka akjhemachandra kasun.subasinghe
ta,76,தமிழ்,Tamil,M. Palaniappan Jiyath ahamed ayyanprasathpalani SBSCC dr.kumarasingam mail2muthuram sundaresanraja thavaruban Mohamed Basheer sathyayuge24 kvenkat_2k1 befrontliner
ca,74,català,Catalan,Quim Gual
dv,73,Divehi,Divehi,ޔާސިފް abdhulla.alim
ru,72,русский,Russian,mprokopov Anastasia Оля Stepan Galkin azampas Ramonkz broslavski natalia.pokrovskaya
bs,71,bosanski,Bosnian,dino.bojcic logical ahajdar adnan Vesmir Ruznic sraslan
ms,69,Bahasa Melayu,Malay,firdauspr auradash hamzah norman05051984 aeo.ashraf detjohn13 asyrafkhairuddin92 Rshd Mohd mydispomail-001 cskhua idea_hairul od3n mysycsolutions amirul.asswad adrysabry halimhamdan
uz,68,oʻzbekcha,Uzbek,Diyor
zh-CN,66,中文(简体),Simplified Chinese (China),zlg.happy thresh14 fantacyzc ryan.lufh jameslee4848 xoojulian zack hzfywkj 593915157 beiruoyi_1016 yanchoo admin tony.tong jtayyw
bn,62,বাংলা,Bengali,andrew Monowar Hossain sykat007 iktheruddin096 hasandhali arif.css123 qstar.inc mazhar266 hasan87abc mannuinfo rashidul6 shafizelal ceo contact Md. Ikramul Hossain  polashpalchowdury topu11543 jessoreit
fi,61,suomi,Finnish,Juha Auvinen shotdog mikko
my,58,မြန်မာစာ,Burmese,Lin Win Thu tunwn.mdy mbanyar033 pyephyoeaung1
th,57,ไทย,Thai,Pichaya.L ChiVasCz nattariya kunthawat ssrinora saravuthc suratlee tawat.ted
no,56,norsk,Norwegian,Kevin Jung Park theodor Rune Michael Hofstad alexander.dawson
ur,50,اُردو,Urdu,aasim.sethi tmntbob Moeen Hashmi Hassaan Khawer Amjad Cheema thenewelectricstore muhammadatif.memon mshahid7194090 usrana52 awais_sohail89 saqib.pcg jahangir.amin ajmal.kh86 mzraza celticom ashfaq202 91.syedhunain
pl,50,polski,Polish,Krzysztof Pilars greg goliat4 daaaaniel atudetank info rzeka
ko,48,한국어,Korean,ingen
hu,48,magyar,Hungarian,radi Pal Turcsan pmarjai radnog zolenor gabor
zh-TW,45,中文(台灣),Traditional Chinese (Taiwan),assanges simon.tai Jefferson matt81412 c.hwa.liu iverson83102005 macho9929
hi,41,हिंदी,Hindi,Sameer Gupta anshumang244 pradeepkumarjangir pgaworld robin08rangi universalmedicaregkp ss621480 jbmakwana1 hunaidzaki patel8795
it,36,italiano,Italian,a.giordano.mi tommaso.muro ruozzistefano Enrico Baioni grassi.alessio francesco.monte davide io webmaster brigo92.pb aces85 info Daniele Giulianelli piccioli66 m.apice74 fbgulotta jessica.oppedisano nlogozzo123 alby aurasanu
mn,36,Mongɣol kele,Mongolian,munkh.munkhsoyol dulguunb ireedui2k5 daj_bud
bg,32,български,Bulgarian,y.hinov simeonov.martin krapchev dimo.chankov ivanov.ivaylo
uk,27,українська,Ukrainian,dgorbachov julia.litovenko d.matiushko swet92
ne,27,नेपाली,Nepali,Shital Subedi psychrabi rushon_4life srsroshan16 surendra.chand8 knocktouraj
ku,24,کوردی,Kurdish,diyako eye.aram ibrahimqadir rebazsalih barhambakr
he,23,עברית,Hebrew,Isaac Portal sergey.rav danielh101 nir
be,20,Беларускі,Belarusian,6598335
so,19,Af-Soomaali,Somali,hasantanni mudey001 liinxasan10
ml,19,മലയാളം,Malayalam,supergassales shinerajendran xkaterboi chinturj rafeekpp muraliksa sameerudma spacesofttech musthafaanas sameeh1986
cs,17,čeština,Czech,lukas Daniel Vítek karel.jakub Petr Paťha
gl,17,galego,Galician,Diego Represas
fy,17,Frysk,Frisian,land_wilco
ka,16,ქართული,Georgian,sssfile g.mikaia gzirishvili gzviadadze bmamuka
gu,10,ગુજરાતી,Gujarati,thenewelectricstore Mayur Vyas samism.91 info.navkarsoftware patel8795
as,8,অসমীয়া,Assamese,mishra.ksarma2014 mksarma.ngo
kk,7,Қазақ тілі,Kazakh,genakarpov97
km,7,ភាសាខ្មែរ,Cambodian,admin translate
sw,6,Kiswahili,Kiswahili,atbazel faraji5 jamesmpemba kweixalice
ja,6,日本語,Japanese,matsumoto htapmk22
lv,3,latviešu,Latvian,sk inaram
bo,1,Tibetan,Tibetan,mlbodyig