code,percentage,localname,englishname,contributors
ar,100,العربية,Arabic,Haitham Doraidy mohammad naji yaser nanoua Abdulbari mokhles.atallah efaiald Yasser Elkhateeb €gypt southern.carpenter majed404 imosa3da a.gamal.eldin88 luai.naji k.alqaheri loubani.yahia samarrai m256a acc.mohamedhamza88 adnan facysd SBSCC aalkaf.94 usama.ibraheem z.kheliwi akhatib scony10 aabuzaid omair5354 atmaalouf ali.nasser.93 magasal20 asaawan bookkuwait osman.a.mahmoud mohammedessam111 aymanaaat mohammadayoubq jihad rizkadel ashraf.i.salameh yasir_smart8889 omarelmasry2006
nl,100,Nederlands,Dutch,Ernst Bunders Hennie Eerhart martijn vincent Tomasz Nguyen carel.ketelaars Paul van Rijn Mehh Yorrick Hardeman tomas.scheldeman Richard Martijn D. Aart van Oploo joost Jos Geluk Anton Frank sraslan reyjamin aartdijkstra rory Mitch Gooijer 2BeFresh ingeschuffelen rob raymondlukassen marloesknetemann t.aski rikroukens Reggie Dinsbach alex bram.kort peterfick.nl
id,100,Bahasa Indonesia,Indonesian,reyjamin stanisk3101 Yhoga Heru Pratama kapkuncara Ajisaka teddie tesargusmawan w.nugrahadi mandau Anies Pertiwi adipriyanto.bpn darmawan.sidiq 19.guardians rahmat khairfathul jeppy.chriz fikri514 herrycandi1963 mastertranskrip bermansnbbn rhama.donny sariningbhuana tuliskode morsen_hepi amantun ubaylicious dnirawan79 didi.purwadi
el,100,Ελληνικά,Greek,ntrimmis Antonis Vlachos pandhm Kostas Subdee giorgos.arnakis manolis Stathis Mellios dpantoulas skazakis nitro912gr theodorakisg leongreece info panarapi forologinpc pcon konstantinos.tsatsarounos aristeidisgkoros vcharlos delliospetros
vi,100,Tiếng Việt,Vietnamese,Vũ Văn Hoàn - Asanzo Hà Nội buitrunghau yewleung Nguyễn Đình Quân Duy Trung tbn.tran93 hungphamquoc Pablo Alvarado lxkhanh189 hoanglongrs xoojulian lequanghoa
de,100,Deutsch,German,Daniel Ruf Marko Langer d_k1 nielsaufdeepspace9 khargoth24 taieyaman tosho1994 Manuel Klarmann Daniel Banck arno abdulshafie99
sr,100,srpski,Serbian,analiza.fin.izvjestaja vojkan.milovanovic dragan.vukosavljevic Nikola Maric Dr Nedic Nikola dragoslav.nikolic tanicbozidar bojanpavlovicoffice draganmatrox Goran Jordović
af,100,Afrikaans,Afrikaans,martinmeyer007 jannie durkpotgieter claudine.venter1 thinusg belinda.truscott hitimanajphugues gerhard.bez alex.caudron Andrew van der Spuy
is,100,íslenska,Icelandic,Gunnar Geir snaei8 heimir kjartansverrisson mattiazer omar vorverk ingimarjons advocat
mk,100,македонски јазик,Macedonian,novica Predrag Tasevski marko.aleksov gligorovski.g dlalkov
sq,100,shqipe,Albanian,Egzon Prokupla jurild_hoxha Suad A. Tafili atdhe_19 taulant.haxholli
zh-HK,100,中文(香港),Traditional Chinese (Hong Kong),erph.com.hk
et,99,eesti,Estonian,Gunnar Michelson jjk arva.arp raha 6598335 rivozangov secret123
lt,98,lietuvių,Lithuanian,MES GALIM irina edlu73 ramunas atolodas andrius Povilas Klusas
pt,97,Português,Portuguese,Manuela Silva bmrcarneiro Nuno Lopes celexi Alexsander Donay Samuel Mesquita Ana Fonseca ido sooskca chinguelessi euhudson godoyjon guilhermeschneiderbr felipe osmar.mateus diego.viegas luiz Lucas Luis Panao aapinto
tr,97,Türkçe,Turkish,ahmetnsr07 erincfirtina posta Ufuk enesemretas ŞENOL KOÇAN bunyaminkoz ademalp selimelitas7 ipek srknakarcay ilham123836 brnozcan alisanari doganhatip a.kadirgngr İsmail Demirbilek alierhanersoy ahmet artunalyan okanciftci34 talatcorak netusta berke.turgan Egzon Prokupla
ro,94,română,Romanian,consult.brasov paul.pitea Sorin vfrunza Catalin Dragomirescu vasile.chisu toda ioan
fa,93,فارسى,Persian,pnshad Aiub MRNasseri o.ahmadi.mail monib19 hamzelo.ali mehdi_song torabian.7 metalixon mo_jair efa kamitoto1995 programingc42 navidhaghi waheed peyman.mohamadpour
sv,92,svenska,Swedish,Jan-Eric Lindh larsonniwik Fredrik Duwell mattenrone
es,88,español,Spanish,Marco Picón oscargonz Diego Represas jf150552 taxmatters.richmond cametiope romsaz info juanmagic01 josegjimenez greatexe Luis Galvez lublanchod fernando.lguevara Angel luis info egonzalez Freddy Isaac osorio022 Luigi caparra leonsk29 antoniomagagna rodrigo.ortiz malrod info alaskamama flira1010 ferwind des arlopeza waldinads1987 franciscobama leoxordonez gustavo
sk,87,slovenčina,Slovak,managerioslovak Lubos Hasko hiddenvs pavol.paluga Július Meri monikafoster lubos
de-CH,84,Deutsch (Schweiz),German (Switzerland),Radio64 johnwhosmithwatson Phantom75 wkfrehner
hr,83,hrvatski,Croatian,vedran.ivancevic daniel.phenomena frost.giant.miniatures zsvegar darko.borojevic bbbbxxx civija mario.strmen.dvorski christian misic.mirko
fr,83,français,French,antoinebargel nujabe.com webtranslateit.com 500assets.com jpmorin nicolas julien Erwin Mayer scialet Daniel G olivier.asselin doris.gagnon eriam kdaffef Wesly  pavel robert ju alexandrehitchcox alexandre.gauvin natalia.pokrovskaya karensg.mk lamarane chsmo33 antoine.rouse mickaelramanitrera rabodanmaha Abdellah Elfilali
az,83,Azərbaycan,Azeri,anarsmac elxan96 90ez090 moize
sl,82,slovenski,Slovenian,David blaziusgr Silvo Jakob Gregor Sušanj Jure Medved Ivo foseklin marko.munda andrej.volpi lionidas0001 bostjan.petru thegreatwise
te,78,తెలుగు,Telugu,sekhar.apps10 kesava reddy hana raj.nann vsurimanchi vveeru19
si,77,siṁhala,Sinhala,admin Pahan SBSCC virajkavn sheronwollas chanakaicdl thisara.gunathilaka kasun.subasinghe akjhemachandra
ta,77,தமிழ்,Tamil,M. Palaniappan Jiyath ahamed ayyanprasathpalani SBSCC dr.kumarasingam mail2muthuram sundaresanraja befrontliner sathyayuge24 kvenkat_2k1 Mohamed Basheer thavaruban
ca,75,català,Catalan,Quim Gual
dv,74,Divehi,Divehi,ޔާސިފް abdhulla.alim
ru,72,русский,Russian,mprokopov Anastasia Оля Stepan Galkin azampas Ramonkz natalia.pokrovskaya broslavski
bs,72,bosanski,Bosnian,dino.bojcic logical ahajdar adnan Vesmir Ruznic sraslan
ms,69,Bahasa Melayu,Malay,firdauspr auradash hamzah norman05051984 aeo.ashraf detjohn13 asyrafkhairuddin92 Rshd Mohd mydispomail-001 idea_hairul cskhua amirul.asswad mysycsolutions halimhamdan od3n adrysabry
uz,68,oʻzbekcha,Uzbek,Diyor
fi,62,suomi,Finnish,Juha Auvinen shotdog mikko
bn,62,বাংলা,Bengali,andrew Monowar Hossain sykat007 iktheruddin096 arif.css123 qstar.inc hasan87abc mazhar266 ceo contact topu11543 rashidul6 polashpalchowdury shafizelal jessoreit Md. Ikramul Hossain  mannuinfo
zh-CN,59,中文(简体),Simplified Chinese (China),zlg.happy fantacyzc ryan.lufh jameslee4848 xoojulian zack hzfywkj 593915157 beiruoyi_1016 jtayyw admin yanchoo tony.tong
my,59,မြန်မာစာ,Burmese,Lin Win Thu tunwn.mdy mbanyar033
th,58,ไทย,Thai,Pichaya.L ChiVasCz nattariya kunthawat ssrinora saravuthc suratlee tawat.ted
no,57,norsk,Norwegian,Kevin Jung Park theodor Rune Michael Hofstad alexander.dawson
da,51,dansk,Danish,finnwandersen Torben Hasse Kirkegaard railer12 soren wegeberg kurtha bkooss
ur,51,اُردو,Urdu,aasim.sethi tmntbob Moeen Hashmi Hassaan Khawer Amjad Cheema thenewelectricstore muhammadatif.memon mshahid7194090 mzraza usrana52 91.syedhunain saqib.pcg ashfaq202 celticom awais_sohail89
pl,51,polski,Polish,Krzysztof Pilars greg goliat4 daaaaniel atudetank info rzeka
ko,49,한국어,Korean,ingen
hu,48,magyar,Hungarian,radi Pal Turcsan pmarjai radnog gabor zolenor
zh-TW,46,中文(台灣),Traditional Chinese (Taiwan),assanges simon.tai Jefferson matt81412 c.hwa.liu macho9929 iverson83102005
it,36,italiano,Italian,a.giordano.mi tommaso.muro ruozzistefano Enrico Baioni grassi.alessio francesco.monte davide io webmaster brigo92.pb aces85 info Daniele Giulianelli piccioli66 aurasanu alby m.apice74 nlogozzo123 jessica.oppedisano
mn,36,Mongɣol kele,Mongolian,munkh.munkhsoyol dulguunb ireedui2k5 daj_bud
bg,32,български,Bulgarian,y.hinov simeonov.martin krapchev dimo.chankov ivanov.ivaylo
uk,27,українська,Ukrainian,dgorbachov julia.litovenko swet92 d.matiushko
ne,27,नेपाली,Nepali,Shital Subedi psychrabi rushon_4life srsroshan16 knocktouraj surendra.chand8
hi,25,हिंदी,Hindi,Sameer Gupta pradeepkumarjangir pgaworld robin08rangi universalmedicaregkp ss621480 jbmakwana1 hunaidzaki patel8795
ku,25,کوردی,Kurdish,diyako eye.aram ibrahimqadir rebazsalih barhambakr
he,22,עברית,Hebrew,Isaac Portal danielh101 nir
be,20,Беларускі,Belarusian,6598335
so,19,Af-Soomaali,Somali,hasantanni mudey001 liinxasan10
ml,19,മലയാളം,Malayalam,supergassales shinerajendran xkaterboi rafeekpp muraliksa sameerudma musthafaanas spacesofttech sameeh1986
cs,17,čeština,Czech,lukas Daniel Vítek karel.jakub
gl,17,galego,Galician,Diego Represas
fy,17,Frysk,Frisian,land_wilco
ka,16,ქართული,Georgian,sssfile g.mikaia gzirishvili gzviadadze
gu,10,ગુજરાતી,Gujarati,thenewelectricstore Mayur Vyas samism.91 info.navkarsoftware patel8795
as,9,অসমীয়া,Assamese,mishra.ksarma2014 mksarma.ngo
kk,7,Қазақ тілі,Kazakh,genakarpov97
km,7,ភាសាខ្មែរ,Cambodian,admin translate
ja,6,日本語,Japanese,matsumoto htapmk22
sw,5,Kiswahili,Kiswahili,faraji5 jamesmpemba kweixalice
lv,3,latviešu,Latvian,sk inaram
bo,1,Tibetan,Tibetan,mlbodyig