code,percentage,localname,englishname,contributors
nl,100,Nederlands,Dutch,Ernst Bunders Hennie Eerhart martijn vincent Daniel Hofstede Tomasz Nguyen carel.ketelaars Paul van Rijn Mehh Yorrick Hardeman tomas.scheldeman Richard Martijn D. Aart van Oploo joost Jos Geluk Anton Frank sraslan reyjamin aartdijkstra rory Mitch Gooijer ingeschuffelen 2BeFresh rob raymondlukassen bram.kort peterfick.nl marloesknetemann rikroukens alex t.aski Reggie Dinsbach
pt,100,Português,Portuguese,bmrcarneiro Manuela Silva Nuno Lopes celexi Alexsander Donay Samuel Mesquita Ana Fonseca ido sooskca euhudson guilhermeschneiderbr luiz felipe aapinto Luis Panao osmar.mateus diego.viegas Lucas
is,100,íslenska,Icelandic,Gunnar Geir snaei8 heimir kjartansverrisson mattiazer vorverk advocat
sq,100,shqipe,Albanian,Egzon Prokupla atdhe_19
zh-HK,100,中文(香港),Traditional Chinese (Hong Kong),ERPH.com.hk
id,98,Bahasa Indonesia,Indonesian,reyjamin stanisk3101 kapkuncara Ajisaka teddie tesargusmawan w.nugrahadi mandau Anies Pertiwi adipriyanto.bpn darmawan.sidiq yhoga.pratama 19.guardians rahmat jeppy.chriz herrycandi1963 rhama.donny bermansnbbn didi.purwadi amantun dnirawan79 sariningbhuana tuliskode mastertranskrip ubaylicious morsen_hepi
et,98,eesti,Estonian,Gunnar Michelson jjk arva.arp raha 6598335 secret123 rivozangov
sr,97,srpski,Serbian,vojkan.milovanovic dragan.vukosavljevic Nikola Maric analiza.fin.izvjestaja dragoslav.nikolic tanicbozidar bojanpavlovicoffice Goran Jordović
tr,97,Türkçe,Turkish,ahmetnsr07 erincfirtina Ufuk posta enesemretas ŞENOL KOÇAN bunyaminkoz ademalp selimelitas7 ipek ilham123836 brnozcan alisanari doganhatip a.kadirgngr İsmail Demirbilek ahmet alierhanersoy Egzon Prokupla okanciftci34 netusta artunalyan berke.turgan talatcorak
lt,96,lietuvių,Lithuanian,MES GALIM irina edlu73 ramunas atolodas Povilas Klusas andrius
ar,95,العربية,Arabic,Haitham Doraidy mohammad naji yaser nanoua efaiald Yasser Elkhateeb €gypt southern.carpenter majed404 imosa3da a.gamal.eldin88 luai.naji k.alqaheri loubani.yahia samarrai adnan facysd SBSCC usama.ibraheem akhatib scony10 omair5354 magasal20 ali.nasser.93 asaawan atmaalouf omarelmasry2006 osman.a.mahmoud mohammedessam111 yasir_smart8889 rizkadel mohammadayoubq aabuzaid ashraf.i.salameh
es,93,español,Spanish,Marco Picón oscargonz Diego Represas jf150552 taxmatters.richmond cametiope romsaz info juanmagic01 josegjimenez greatexe Luis Galvez lublanchod fernando.lguevara Angel luis info Freddy Isaac egonzalez osorio022 caparra Luigi leonsk29 info franciscobama arlopeza des leoxordonez malrod antoniomagagna rodrigo.ortiz alaskamama flira1010 ferwind
sv,92,svenska,Swedish,Jan-Eric Lindh larsonniwik Fredrik Duwell mattenrone
el,88,Ελληνικά,Greek,ntrimmis Antonis Vlachos Kostas Subdee giorgos.arnakis skazakis Stathis Mellios dpantoulas nitro912gr theodorakisg leongreece info panarapi pcon konstantinos.tsatsarounos aristeidisgkoros vcharlos delliospetros
de-CH,88,Deutsch (Schweiz),German (Switzerland),Radio64 johnwhosmithwatson Phantom75
fa,88,فارسى,Persian,pnshad Aiub MRNasseri monib19 mehdi_song torabian.7 metalixon mo_jair efa programingc42 kamitoto1995 navidhaghi waheed peyman.mohamadpour
fr,88,français,French,antoinebargel nujabe.com webtranslateit.com 500assets.com jpmorin nicolas julien Erwin Mayer scialet Daniel G doris.gagnon olivier.asselin eriam kdaffef pavel Wesly  ju alexandre.gauvin alexandrehitchcox antoine.rouse chsmo33 Abdellah Elfilali mickaelramanitrera natalia.pokrovskaya lamarane rabodanmaha
ro,87,română,Romanian,consult.brasov paul.pitea Sorin Catalin Dragomirescu vasile.chisu toda ioan
sl,87,slovenski,Slovenian,David blaziusgr Silvo Jakob Gregor Sušanj Jure Medved Ivo foseklin marko.munda andrej.volpi lionidas0001 bostjan.petru thegreatwise
hr,87,hrvatski,Croatian,vedran.ivancevic daniel.phenomena frost.giant.miniatures zsvegar darko.borojevic bbbbxxx civija mario.strmen.dvorski misic.mirko christian
te,83,తెలుగు,Telugu,sekhar.apps10 kesava reddy hana raj.nann vsurimanchi vveeru19
si,81,siṁhala,Sinhala,admin Pahan SBSCC virajkavn sheronwollas chanakaicdl thisara.gunathilaka kasun.subasinghe
ca,80,català,Catalan,Quim Gual
ta,79,தமிழ்,Tamil,M. Palaniappan Jiyath ahamed ayyanprasathpalani SBSCC mail2muthuram kvenkat_2k1 Mohamed Basheer befrontliner sundaresanraja thavaruban
sk,79,slovenčina,Slovak,hiddenvs pavol.paluga Július Meri
bs,75,bosanski,Bosnian,dino.bojcic logical ahajdar adnan Vesmir Ruznic sraslan
mk,74,македонски јазик,Macedonian,Predrag Tasevski marko.aleksov novica gligorovski.g dlalkov
dv,73,Divehi,Divehi,ޔާސިފް abdhulla.alim
vi,71,Tiếng Việt,Vietnamese,buitrunghau Vũ Văn Hoàn Nguyễn Đình Quân Duy Trung tbn.tran93 hungphamquoc lequanghoa xoojulian lxkhanh189 hoanglongrs
ru,69,русский,Russian,mprokopov Anastasia Оля Stepan Galkin azampas Ramonkz natalia.pokrovskaya broslavski
ms,63,Bahasa Melayu,Malay,firdauspr auradash hamzah norman05051984 detjohn13 Rshd Mohd cskhua idea_hairul amirul.asswad od3n mysycsolutions adrysabry
my,62,မြန်မာစာ,Burmese,Lin Win Thu tunwn.mdy
de,61,Deutsch,German,Daniel Ruf marko.langer d_k1 nielsaufdeepspace9 khargoth24 Manuel Klarmann Daniel Banck arno abdulshafie99
th,61,ไทย,Thai,Pichaya.L ChiVasCz nattariya kunthawat ssrinora saravuthc suratlee tawat.ted
no,60,norsk,Norwegian,Kevin Jung Park theodor Rune Michael Hofstad alexander.dawson
bn,59,বাংলা,Bengali,andrew Monowar Hossain sykat007 arif.css123 qstar.inc hasan87abc contact Md. Ikramul Hossain  shafizelal rashidul6 topu11543 polashpalchowdury jessoreit ceo
zh-CN,57,中文(简体),Simplified Chinese (China),zlg.happy fantacyzc ryan.lufh xoojulian zack hzfywkj 593915157 beiruoyi_1016 tony.tong yanchoo jtayyw admin
af,57,Afrikaans,Afrikaans,jannie durkpotgieter claudine.venter1 thinusg belinda.truscott gerhard.bez alex.caudron Andrew van der Spuy
da,54,dansk,Danish,finnwandersen Torben Hasse Kirkegaard railer12 soren wegeberg kurtha bkooss
ur,53,اُردو,Urdu,aasim.sethi tmntbob Moeen Hashmi Hassaan Khawer thenewelectricstore muhammadatif.memon usrana52 mshahid7194090 91.syedhunain mzraza ashfaq202 awais_sohail89
ko,51,한국어,Korean,ingen
fi,51,suomi,Finnish,Juha Auvinen mikko
hu,50,magyar,Hungarian,radi Pal Turcsan pmarjai radnog zolenor gabor
pl,48,polski,Polish,Krzysztof Pilars greg daaaaniel atudetank info rzeka
zh-TW,43,中文(台灣),Traditional Chinese (Taiwan),assanges simon.tai matt81412 c.hwa.liu iverson83102005 macho9929
mn,37,Mongɣol kele,Mongolian,munkh.munkhsoyol dulguunb ireedui2k5 daj_bud
it,36,italiano,Italian,a.giordano.mi ruozzistefano Enrico Baioni grassi.alessio francesco.monte io webmaster brigo92.pb aces85 info Daniele Giulianelli piccioli66 alby aurasanu jessica.oppedisano nlogozzo123
bg,33,български,Bulgarian,y.hinov simeonov.martin krapchev
az,29,Azərbaycan,Azeri,anarsmac 90ez090 moize
uk,28,українська,Ukrainian,dgorbachov julia.litovenko d.matiushko swet92
ne,28,नेपाली,Nepali,Shital Subedi psychrabi rushon_4life srsroshan16 knocktouraj
ku,26,کوردی,Kurdish,diyako eye.aram ibrahimqadir
hi,24,हिंदी,Hindi,pradeepkumarjangir pgaworld robin08rangi ss621480 jbmakwana1 patel8795 Sameer Gupta hunaidzaki
he,23,עברית,Hebrew,Isaac Portal danielh101 nir
be,21,Беларускі,Belarusian,6598335
ml,20,മലയാളം,Malayalam,supergassales shinerajendran xkaterboi rafeekpp muraliksa sameeh1986 musthafaanas sameerudma spacesofttech
gl,18,galego,Galician,Diego Represas
fy,18,Frysk,Frisian,Daniel Hofstede land_wilco
cs,18,čeština,Czech,lukas Daniel Vítek karel.jakub
ka,17,ქართული,Georgian,sssfile g.mikaia gzirishvili
so,11,Af-Soomaali,Somali,mudey001 liinxasan10
kk,8,Қазақ тілі,Kazakh,genakarpov97
km,7,ភាសាខ្មែរ,Cambodian,admin translate
ja,7,日本語,Japanese,matsumoto htapmk22
sw,5,Kiswahili,Kiswahili,faraji5 jamesmpemba kweixalice
lv,3,latviešu,Latvian,sk inaram
gu,3,ગુજરાતી,Gujarati,mv9693 samism.91 info.navkarsoftware patel8795
bo,1,Tibetan,Tibetan,mlbodyig