code,percentage,localname,englishname,contributors
nl,100,Nederlands,Dutch,Ernst Bunders Hennie Eerhart martijn vincent Daniel Hofstede Tomasz Nguyen carel.ketelaars Paul van Rijn Mehh Yorrick Hardeman tomas.scheldeman Richard Martijn D. Aart van Oploo joost Anton Jos Geluk Frank sraslan reyjamin aartdijkstra rory Mitch Gooijer ingeschuffelen rob 2BeFresh marloesknetemann alex t.aski Reggie Dinsbach bram.kort raymondlukassen rikroukens peterfick.nl
tr,100,Türkçe,Turkish,ahmetnsr07 erincfirtina Ufuk posta enesemretas ŞENOL KOÇAN bunyaminkoz ademalp selimelitas7 ipek srknakarcay ilham123836 brnozcan alisanari doganhatip İsmail Demirbilek a.kadirgngr berke.turgan okanciftci34 netusta talatcorak ahmet artunalyan alierhanersoy Egzon Prokupla
af,100,Afrikaans,Afrikaans,martinmeyer007 jannie durkpotgieter claudine.venter1 thinusg belinda.truscott gerhard.bez alex.caudron Andrew van der Spuy
et,100,eesti,Estonian,Gunnar Michelson jjk arva.arp raha 6598335 secret123 rivozangov
is,100,íslenska,Icelandic,Gunnar Geir snaei8 heimir kjartansverrisson mattiazer advocat vorverk
zh-HK,100,中文(香港),Traditional Chinese (Hong Kong),ERPH.com.hk
pt,99,Português,Portuguese,bmrcarneiro Manuela Silva Nuno Lopes celexi Alexsander Donay Samuel Mesquita Ana Fonseca ido sooskca euhudson aapinto diego.viegas Lucas osmar.mateus Luis Panao guilhermeschneiderbr luiz felipe
sq,99,shqipe,Albanian,Egzon Prokupla atdhe_19
id,98,Bahasa Indonesia,Indonesian,reyjamin stanisk3101 kapkuncara Ajisaka teddie tesargusmawan w.nugrahadi mandau Anies Pertiwi adipriyanto.bpn darmawan.sidiq yhoga.pratama 19.guardians rahmat jeppy.chriz herrycandi1963 sariningbhuana tuliskode mastertranskrip ubaylicious morsen_hepi rhama.donny amantun dnirawan79 bermansnbbn didi.purwadi
sr,97,srpski,Serbian,vojkan.milovanovic dragan.vukosavljevic Nikola Maric analiza.fin.izvjestaja dragoslav.nikolic tanicbozidar bojanpavlovicoffice Goran Jordović
lt,96,lietuvių,Lithuanian,MES GALIM irina edlu73 ramunas atolodas andrius Povilas Klusas
ar,95,العربية,Arabic,Haitham Doraidy mohammad naji yaser nanoua efaiald Yasser Elkhateeb €gypt southern.carpenter majed404 imosa3da a.gamal.eldin88 luai.naji k.alqaheri loubani.yahia samarrai adnan facysd SBSCC usama.ibraheem akhatib scony10 omarelmasry2006 mohammedessam111 yasir_smart8889 bookkuwait rizkadel mohammadayoubq ashraf.i.salameh aabuzaid asaawan osman.a.mahmoud atmaalouf ali.nasser.93 magasal20 omair5354
es,93,español,Spanish,Marco Picón oscargonz Diego Represas jf150552 taxmatters.richmond cametiope romsaz info juanmagic01 josegjimenez greatexe Luis Galvez lublanchod fernando.lguevara Angel luis info egonzalez Freddy Isaac osorio022 Luigi caparra arlopeza des antoniomagagna rodrigo.ortiz flira1010 malrod ferwind info leonsk29 alaskamama leoxordonez franciscobama
sv,91,svenska,Swedish,Jan-Eric Lindh larsonniwik Fredrik Duwell mattenrone
mk,89,македонски јазик,Macedonian,Predrag Tasevski marko.aleksov novica gligorovski.g dlalkov
hr,88,hrvatski,Croatian,vedran.ivancevic daniel.phenomena frost.giant.miniatures zsvegar darko.borojevic bbbbxxx civija mario.strmen.dvorski christian misic.mirko
el,88,Ελληνικά,Greek,ntrimmis Antonis Vlachos Kostas Subdee giorgos.arnakis skazakis Stathis Mellios dpantoulas nitro912gr theodorakisg leongreece info panarapi pcon konstantinos.tsatsarounos aristeidisgkoros vcharlos delliospetros
de-CH,88,Deutsch (Schweiz),German (Switzerland),Radio64 johnwhosmithwatson Phantom75
fr,88,français,French,antoinebargel nujabe.com webtranslateit.com 500assets.com jpmorin nicolas julien Erwin Mayer scialet Daniel G olivier.asselin doris.gagnon eriam kdaffef Wesly  pavel robert ju alexandre.gauvin alexandrehitchcox Abdellah Elfilali lamarane rabodanmaha mickaelramanitrera natalia.pokrovskaya chsmo33 antoine.rouse
fa,88,فارسى,Persian,pnshad Aiub MRNasseri monib19 mehdi_song torabian.7 metalixon mo_jair efa kamitoto1995 programingc42 navidhaghi waheed peyman.mohamadpour
ro,87,română,Romanian,consult.brasov paul.pitea Sorin Catalin Dragomirescu vasile.chisu toda ioan
sl,86,slovenski,Slovenian,David blaziusgr Silvo Jakob Gregor Sušanj Jure Medved Ivo foseklin marko.munda andrej.volpi lionidas0001 bostjan.petru thegreatwise
te,83,తెలుగు,Telugu,sekhar.apps10 kesava reddy hana raj.nann vsurimanchi vveeru19
si,81,siṁhala,Sinhala,admin Pahan SBSCC virajkavn sheronwollas chanakaicdl thisara.gunathilaka kasun.subasinghe
ca,79,català,Catalan,Quim Gual
ta,79,தமிழ்,Tamil,M. Palaniappan Jiyath ahamed ayyanprasathpalani SBSCC mail2muthuram Mohamed Basheer sundaresanraja befrontliner thavaruban kvenkat_2k1
sk,79,slovenčina,Slovak,hiddenvs pavol.paluga Július Meri
ru,77,русский,Russian,mprokopov Anastasia Оля Stepan Galkin azampas Ramonkz natalia.pokrovskaya broslavski
bs,75,bosanski,Bosnian,dino.bojcic logical ahajdar adnan Vesmir Ruznic sraslan
vi,73,Tiếng Việt,Vietnamese,buitrunghau Vũ Văn Hoàn Nguyễn Đình Quân Duy Trung tbn.tran93 hungphamquoc xoojulian lxkhanh189 hoanglongrs lequanghoa Pablo Alvarado
dv,73,Divehi,Divehi,ޔާސިފް abdhulla.alim
ms,63,Bahasa Melayu,Malay,firdauspr auradash hamzah norman05051984 detjohn13 Rshd Mohd asyrafkhairuddin92 idea_hairul cskhua od3n mysycsolutions adrysabry amirul.asswad
my,62,မြန်မာစာ,Burmese,Lin Win Thu tunwn.mdy mbanyar033
th,61,ไทย,Thai,Pichaya.L ChiVasCz nattariya kunthawat ssrinora saravuthc suratlee tawat.ted
de,61,Deutsch,German,Daniel Ruf marko.langer d_k1 nielsaufdeepspace9 khargoth24 Manuel Klarmann Daniel Banck arno abdulshafie99
no,60,norsk,Norwegian,Kevin Jung Park theodor Rune Michael Hofstad alexander.dawson
bn,59,বাংলা,Bengali,andrew Monowar Hossain sykat007 arif.css123 qstar.inc hasan87abc shafizelal rashidul6 topu11543 polashpalchowdury jessoreit ceo contact Md. Ikramul Hossain 
zh-CN,57,中文(简体),Simplified Chinese (China),zlg.happy fantacyzc ryan.lufh xoojulian zack hzfywkj tony.tong yanchoo jtayyw admin 593915157 beiruoyi_1016
da,54,dansk,Danish,finnwandersen Torben Hasse Kirkegaard railer12 soren wegeberg kurtha bkooss
ur,53,اُردو,Urdu,aasim.sethi tmntbob Moeen Hashmi Hassaan Khawer thenewelectricstore muhammadatif.memon ashfaq202 91.syedhunain usrana52 awais_sohail89 mzraza mshahid7194090
ko,52,한국어,Korean,ingen
fi,51,suomi,Finnish,Juha Auvinen mikko
hu,51,magyar,Hungarian,radi Pal Turcsan pmarjai radnog zolenor gabor
pl,48,polski,Polish,Krzysztof Pilars greg daaaaniel atudetank info rzeka
zh-TW,43,中文(台灣),Traditional Chinese (Taiwan),assanges simon.tai matt81412 c.hwa.liu macho9929 iverson83102005
mn,38,Mongɣol kele,Mongolian,munkh.munkhsoyol dulguunb ireedui2k5 daj_bud
it,36,italiano,Italian,a.giordano.mi ruozzistefano Enrico Baioni grassi.alessio francesco.monte io brigo92.pb webmaster aces85 info piccioli66 Daniele Giulianelli nlogozzo123 jessica.oppedisano aurasanu alby
bg,34,български,Bulgarian,y.hinov simeonov.martin krapchev
az,29,Azərbaycan,Azeri,anarsmac 90ez090 moize
uk,28,українська,Ukrainian,dgorbachov julia.litovenko swet92 d.matiushko
ne,28,नेपाली,Nepali,Shital Subedi psychrabi rushon_4life srsroshan16 knocktouraj
hi,26,हिंदी,Hindi,Sameer Gupta pradeepkumarjangir pgaworld robin08rangi ss621480 jbmakwana1 hunaidzaki patel8795
ku,26,کوردی,Kurdish,diyako eye.aram ibrahimqadir
he,24,עברית,Hebrew,Isaac Portal nir danielh101
be,21,Беларускі,Belarusian,6598335
ml,20,മലയാളം,Malayalam,supergassales shinerajendran xkaterboi rafeekpp muraliksa sameerudma spacesofttech sameeh1986 musthafaanas
gl,19,galego,Galician,Diego Represas
fy,18,Frysk,Frisian,Daniel Hofstede land_wilco
cs,18,čeština,Czech,lukas Daniel Vítek karel.jakub
ka,17,ქართული,Georgian,sssfile g.mikaia gzirishvili
so,11,Af-Soomaali,Somali,mudey001 liinxasan10
gu,10,ગુજરાતી,Gujarati,thenewelectricstore mv9693 samism.91 info.navkarsoftware patel8795
kk,8,Қазақ тілі,Kazakh,genakarpov97
km,7,ភាសាខ្មែរ,Cambodian,admin translate
ja,7,日本語,Japanese,matsumoto htapmk22
sw,5,Kiswahili,Kiswahili,faraji5 jamesmpemba kweixalice
lv,4,latviešu,Latvian,sk inaram
bo,1,Tibetan,Tibetan,mlbodyig